{"$schema":"https://json-schema.org/draft/2020-12/schema","$id":"https://openpassiveradar.org/oprs/evaluation-plan-v1.schema.json","title":"OPRS frozen evaluation plan v1","type":"object","required":["schema","plan_id","plan_hash","system_manifest_hash","evidence_layer","partition","site_epoch_id","receiver_epoch_id","opportunity_envelope","opportunities","required_domains","metric_thresholds"],"properties":{"schema":{"const":"oprs-evaluation-plan-v1"},"plan_id":{"type":"string","minLength":1},"plan_hash":{"type":"string","pattern":"^sha256:[0-9a-f]{64}$"},"system_manifest_hash":{"type":"string","pattern":"^sha256:[0-9a-f]{64}$"},"evidence_layer":{"enum":["pure_synthetic","background_injection","held_out_real"]},"partition":{"const":"evaluation"},"site_epoch_id":{"type":"string","minLength":1},"receiver_epoch_id":{"type":"string","minLength":1},"max_truth_offset_ns":{"type":"integer","minimum":0},"pass_success_min_cpis":{"type":"integer","minimum":1},"opportunity_envelope":{"type":"object","required":["detector_independent","delay_min_km","delay_max_km","doppler_min_hz","doppler_max_hz"],"properties":{"detector_independent":{"const":true},"delay_min_km":{"type":"number"},"delay_max_km":{"type":"number"},"doppler_min_hz":{"type":"number"},"doppler_max_hz":{"type":"number"}}},"opportunities":{"type":"array","minItems":1,"items":{"type":"object","required":["opportunity_id","pass_id","cpi_id","event_time_ns","truth"],"properties":{"opportunity_id":{"type":"string"},"pass_id":{"type":"string"},"cpi_id":{"type":"string"},"event_time_ns":{"type":"integer","minimum":0},"truth":{"type":"object","required":["sample_time_ns","used_by_inference","delay_km","doppler_hz"],"properties":{"sample_time_ns":{"type":"integer"},"used_by_inference":{"const":false},"delay_km":{"type":"number"},"doppler_hz":{"type":"number"},"bearing_deg":{"type":["number","null"]},"truth_source_hash":{"type":"string"}}}}}},"required_domains":{"type":"array","uniqueItems":true,"items":{"type":"string"}},"metric_thresholds":{"type":"object","additionalProperties":{"type":"object","required":["domain","direction","pass","warn"],"properties":{"domain":{"type":"string"},"direction":{"enum":["min","max"]},"pass":{"type":"number"},"warn":{"type":"number"},"unit":{"type":["string","null"]},"aggregation":{"enum":["worst","mean"]}}}}}}
